{
    "label": "round",
    "$schema": "https://raw.githubusercontent.com/DbCrWk/graph-norm/development/schema/scaffold/1.0.0.json",
    "version": "1.0.0",
    "vertices": [
        "a",
        "b",
        "c",
        "d",
        "e",
        "f"
    ],
    "edges": [],
    "graphs": {
        "g1": {
            "label": "g1",
            "vertices": [
                "a",
                "b",
                "c",
                "d",
                "e",
                "f"
            ],
            "edges": [
                ["a","b"],
                ["b","a"],
                ["c", "a"],
                ["b", "c"],
                ["c", "d"],
                ["d", "c"],
                ["e", "d"],
                ["d", "f"],
                ["e", "f"],
                ["f", "e"]
            ]
        },
        "g2": {
            "label": "g2",
            "vertices": [
                "a",
                "b",
                "c",
                "d",
                "e",
                "f"
            ],
            "edges": [
                [
                    "a",
                    "b"
                ],
                [
                    "b",
                    "a"
                ],
                [
                    "c",
                    "a"
                ],
                [
                    "b",
                    "c"
                ],
                [
                    "c",
                    "d"
                ],
                [
                    "d",
                    "c"
                ],
                [
                    "e",
                    "d"
                ],
                [
                    "e",
                    "f"
                ],
                [
                    "f",
                    "e"
                ]
            ]
        },
        "g3": {
            "label": "g3",
            "vertices": [
                "a",
                "b",
                "c",
                "d",
                "e",
                "f"
            ],
            "edges": [
                [
                    "a",
                    "b"
                ],
                [
                    "b",
                    "a"
                ],
                [
                    "c",
                    "a"
                ],
                [
                    "c",
                    "d"
                ],
                [
                    "d",
                    "c"
                ],
                [
                    "e",
                    "f"
                ],
                [
                    "f",
                    "e"
                ]
            ]
        },
        "g4": {
            "label": "g4",
            "vertices": [
                "a",
                "b",
                "c",
                "d",
                "e",
                "f"
            ],
            "edges": [
                [
                    "a",
                    "b"
                ],
                [
                    "b",
                    "a"
                ],
                [
                    "c",
                    "d"
                ],
                [
                    "d",
                    "c"
                ],
                [
                    "e",
                    "f"
                ],
                [
                    "f",
                    "e"
                ]
            ]
        },
        "g5": {
            "label": "g5",
            "vertices": [
                "a",
                "b",
                "c",
                "d",
                "e",
                "f"
            ],
            "edges": [
                [
                    "a",
                    "b"
                ],
                [
                    "b",
                    "a"
                ],
                [
                    "c",
                    "d"
                ],
                [
                    "d",
                    "c"
                ]
            ]
        },
        "g6": {
            "label": "g6",
            "vertices": [
                "a",
                "b",
                "c",
                "d",
                "e",
                "f"
            ],
            "edges": [
                [
                    "a",
                    "b"
                ],
                [
                    "b",
                    "a"
                ]
            ]
        },
        "g7": {
            "label": "g7",
            "vertices": [
                "a",
                "b",
                "c",
                "d",
                "e",
                "f"
            ],
            "edges": []
        }
    },
    "sequence": [
        "g1",
        "g2",
        "g3",
        "g4",
        "g5",
        "g6",
        "g7"
    ]
}
