{
    "label": "round",
    "$schema": "https://raw.githubusercontent.com/DbCrWk/graph-norm/development/schema/scaffold/1.0.0.json",
    "version": "1.0.0",
    "vertices": [
        "a",
        "b",
        "c",
        "d",
        "e",
        "f",
        "g",
        "h"
    ],
    "edges": [],
    "graphs": {
        "g1": {
            "label": "g1",
            "vertices": [
                "a",
                "b",
                "c",
                "d",
                "e",
                "f",
                "g",
                "h"
            ],
            "edges": [
                [
                    "a",
                    "b"
                ],
                [
                    "b",
                    "c"
                ],
                [
                    "c",
                    "d"
                ],
                [
                    "d",
                    "e"
                ],
                [
                    "e",
                    "f"
                ],
                [
                    "f",
                    "g"
                ],
                [
                    "g",
                    "h"
                ],
                [
                    "h",
                    "a"
                ]
            ]
        },
        "g2": {
            "label": "g2",
            "vertices": [
                "a",
                "b",
                "c",
                "d",
                "e",
                "f",
                "g",
                "h"
            ],
            "edges": [
                [
                    "a",
                    "h"
                ],
                [
                    "h",
                    "g"
                ],
                [
                    "g",
                    "f"
                ],
                [
                    "f",
                    "e"
                ],
                [
                    "e",
                    "d"
                ],
                [
                    "d",
                    "c"
                ],
                [
                    "c",
                    "b"
                ],
                [
                    "b",
                    "a"
                ]
            ]
        },
        "g3": {
            "label": "g3",
            "vertices": [
                "a",
                "b",
                "c",
                "d",
                "e",
                "f",
                "g",
                "h"
            ],
            "edges": [
                [
                    "a",
                    "b"
                ],
                [
                    "b",
                    "c"
                ],
                [
                    "c",
                    "d"
                ],
                [
                    "d",
                    "e"
                ],
                [
                    "e",
                    "f"
                ],
                [
                    "f",
                    "g"
                ],
                [
                    "g",
                    "h"
                ],
                [
                    "h",
                    "a"
                ]
            ]
        },
        "g4": {
            "label": "g4",
            "vertices": [
                "a",
                "b",
                "c",
                "d",
                "e",
                "f",
                "g",
                "h"
            ],
            "edges": [
                [
                    "a",
                    "h"
                ],
                [
                    "h",
                    "g"
                ],
                [
                    "g",
                    "f"
                ],
                [
                    "f",
                    "e"
                ],
                [
                    "e",
                    "d"
                ],
                [
                    "d",
                    "c"
                ],
                [
                    "c",
                    "b"
                ],
                [
                    "b",
                    "a"
                ]
            ]
        },
        "g5": {
            "label": "g5",
            "vertices": [
                "a",
                "b",
                "c",
                "d",
                "e",
                "f",
                "g",
                "h"
            ],
            "edges": [
                [
                    "a",
                    "b"
                ],
                [
                    "b",
                    "c"
                ],
                [
                    "c",
                    "d"
                ],
                [
                    "d",
                    "e"
                ],
                [
                    "e",
                    "f"
                ],
                [
                    "f",
                    "g"
                ],
                [
                    "g",
                    "h"
                ],
                [
                    "h",
                    "a"
                ]
            ]
        },
        "g6": {
            "label": "g6",
            "vertices": [
                "a",
                "b",
                "c",
                "d",
                "e",
                "f",
                "g",
                "h"
            ],
            "edges": [
                [
                    "a",
                    "h"
                ],
                [
                    "h",
                    "g"
                ],
                [
                    "g",
                    "f"
                ],
                [
                    "f",
                    "e"
                ],
                [
                    "e",
                    "d"
                ],
                [
                    "d",
                    "c"
                ],
                [
                    "c",
                    "b"
                ],
                [
                    "b",
                    "a"
                ]
            ]
        },
        "g7": {
            "label": "g7",
            "vertices": [
                "a",
                "b",
                "c",
                "d",
                "e",
                "f",
                "g",
                "h"
            ],
            "edges": [
                [
                    "a",
                    "b"
                ],
                [
                    "b",
                    "c"
                ],
                [
                    "c",
                    "d"
                ],
                [
                    "d",
                    "e"
                ],
                [
                    "e",
                    "f"
                ],
                [
                    "f",
                    "g"
                ],
                [
                    "g",
                    "h"
                ],
                [
                    "h",
                    "a"
                ]
            ]
        },
        "g8": {
            "label": "g8",
            "vertices": [
                "a",
                "b",
                "c",
                "d",
                "e",
                "f",
                "g",
                "h"
            ],
            "edges": [
                [
                    "a",
                    "h"
                ],
                [
                    "h",
                    "g"
                ],
                [
                    "g",
                    "f"
                ],
                [
                    "f",
                    "e"
                ],
                [
                    "e",
                    "d"
                ],
                [
                    "d",
                    "c"
                ],
                [
                    "c",
                    "b"
                ],
                [
                    "b",
                    "a"
                ]
            ]
        }
    },
    "sequence": [
        "g1",
        "g2",
        "g3",
        "g4",
        "g5",
        "g6",
        "g7",
        "g8"
    ]
}
