{"$schema":"https://raw.githubusercontent.com/DbCrWk/graph-norm/development/schema/scaffold/1.0.0.json","label":"autogenerated","version":"1.0.0","vertices":["1","2","3","4","5","6","7","8","9","10"],"edges":[],"graphs":{"g₁":{"label":"g₁","edges":[["2","1"],["3","2"],["3","7"],["4","4"],["4","10"],["6","3"],["6","5"],["6","10"],["7","2"],["8","1"],["9","10"]]},"g₂":{"label":"g₂","edges":[["1","6"],["1","10"],["4","2"],["5","3"],["5","4"],["6","10"],["7","3"],["7","6"],["8","3"],["9","5"]]},"g₃":{"label":"g₃","edges":[["3","2"],["3","4"],["3","7"],["5","7"],["6","8"],["8","8"]]},"g₄":{"label":"g₄","edges":[["2","3"],["2","5"],["3","3"],["3","5"],["4","3"],["4","8"],["5","8"],["6","4"],["7","3"],["7","8"],["8","1"],["8","6"],["9","9"]]},"g₅":{"label":"g₅","edges":[["1","2"],["2","4"],["4","7"],["6","8"],["7","4"],["8","4"],["9","6"],["10","7"]]},"g₆":{"label":"g₆","edges":[["1","4"],["3","9"],["3","10"],["4","5"],["5","5"],["6","9"],["8","6"]]},"g₇":{"label":"g₇","edges":[["1","1"],["1","9"],["3","8"],["4","1"],["5","7"],["5","10"],["6","7"],["6","10"],["7","1"],["7","6"],["9","3"]]},"g₈":{"label":"g₈","edges":[["1","1"],["1","3"],["2","5"],["5","2"],["6","1"],["6","10"],["7","3"],["7","8"],["8","1"],["9","10"]]},"g₉":{"label":"g₉","edges":[["1","5"],["2","1"],["2","8"],["3","6"],["4","5"],["5","1"],["5","6"],["7","8"],["8","8"]]},"g₁₀":{"label":"g₁₀","edges":[["1","4"],["3","6"],["5","1"],["8","4"],["8","5"],["9","1"],["9","3"],["9","4"]]}},"sequence":["g₁","g₂","g₃","g₄","g₅","g₆","g₇","g₈","g₉","g₁₀"]}
